{"classification":"incompatible","r_version":"4.5.2","bioconductor":"3.22","packages":{"DESeq2":{"version":"1.50.2","repository":"Bioconductor 3.22"},"SummarizedExperiment":{"version":"1.40.0","repository":"Bioconductor 3.22"},"ggplot2":{"version":"4.0.3","repository":"CRAN"}},"dependency_edges":[{"package":"DESeq2","depends_on":"SummarizedExperiment","minimum_version":"1.1.6"},{"package":"DESeq2","depends_on":"ggplot2","minimum_version":"3.4.0"}],"changed_fields":["r_version"],"rationale":"Bioconductor 3.22 is built for R 4.5. Changing the runtime to 4.5.2 fixes the release mismatch while preserving both package pins and repositories. The selected SummarizedExperiment and ggplot2 versions satisfy the DESeq2 DESCRIPTION lower bounds.","sources":["https://bioconductor.org/about/release-announcements/","https://bioconductor.org/packages/3.22/bioc/html/DESeq2.html"]}
